{
  "id": "preparation-001",
  "department": "preparation",
  "name": "ورود و آماده‌به‌کار شدن پرسنل آماده‌سازی",
  "summary": "پرسنل آماده‌سازی صبح‌ها حدود ۹:۳۰ تا ۹:۴۵ وارد رستوران می‌شوند، در رختکن لباسشان را عوض می‌کنند و فرم رستوران را می‌پوشند، سپس پیش از ساعت ۱۰ انگشت ورود می‌زنند و رأس ساعت ۱۰ آماده‌به‌کار در محیط آماده‌سازی حاضر می‌شوند. ملاک مجموعه ساعت ورود نیست، بلکه حضور آماده‌به‌کار رأس ساعت ۱۰ در آماده‌سازی است؛ چون زمان آماده شدن افراد متفاوت است و برای بعضی ۱۰ دقیقه و برای بعضی تا نیم ساعت طول می‌کشد. سرپرست آماده‌سازی هم سعی می‌کند حدود ۹:۴۵ در مجموعه باشد، لباسش را عوض کند و روپوش بپوشد و رأس ساعت ۱۰ در محیط آماده‌سازی حاضر باشد؛ حضور او باعث می‌شود ورود پرسنل منظم باشد. اگر کسی به دلیل مشکل شخصی یا کاری بیرون از مجموعه نتواند رأس ساعت ۱۰ آماده‌به‌کار باشد، باید از چند ساعت قبل تأخیرش را اعلام کند و سرپرست این موارد را در دفتر مخصوص خود و گزارش‌های روزانه یادداشت می‌کند. تیم آماده‌سازی با احتساب سرپرست پنج نفر است و هر نفر مسئول یکی از لاین‌های سبزیجات، گوشت، مرغ و مرینت و سس است که کار هر لاین از همین ساعت ۱۰ شروع می‌شود.",
  "source": {
    "type": "voice",
    "ref": "20260904-210205",
    "run": "runs/preparation/20260904-210205"
  },
  "parent": null,
  "created_at": "2026-09-04T23:44:41Z",
  "updated_at": "2026-09-04T23:44:41Z",
  "idef0": {
    "inputs": [],
    "controls": [
      "الزام حضور آماده‌به‌کار رأس ساعت ۱۰ صبح در محیط آماده‌سازی",
      "الزام تعویض لباس و پوشیدن فرم رستوران پیش از زدن انگشت ورود",
      "الزام اعلام تأخیر به سرپرست از چند ساعت قبل"
    ],
    "outputs": [
      "حضور آماده‌به‌کار پرسنل آماده‌سازی در محل کار رأس ساعت ۱۰",
      "ثبت ورود پرسنل با اثر انگشت",
      "ثبت تأخیرهای اعلام‌شده در دفتر گزارش روزانه سرپرست"
    ],
    "mechanisms": [
      "پرسنل آماده‌سازی",
      "سرپرست آماده‌سازی",
      "دستگاه ثبت حضور با اثر انگشت",
      "رختکن",
      "فرم (لباس کار) رستوران",
      "دفتر گزارش روزانه سرپرست"
    ]
  },
  "kpis": [],
  "nodes": [
    {
      "id": "preparation-001-n001",
      "type": "activity",
      "label": "ورود پرسنل آماده‌سازی به رستوران بین ساعت ۹:۳۰ تا ۹:۴۵ صبح",
      "description": "زمان لازم برای آماده شدن بین افراد متفاوت است؛ برای بعضی ۱۰ دقیقه و برای بعضی تا نیم ساعت طول می‌کشد، به همین دلیل ملاک مجموعه ساعت ورود نیست بلکه حضور آماده‌به‌کار رأس ساعت ۱۰ در آماده‌سازی است. سرپرست آماده‌سازی هم سعی می‌کند حدود ۹:۴۵ در مجموعه باشد.",
      "actor": "پرسنل آماده‌سازی",
      "icom": {
        "inputs": [],
        "controls": [
          "ملاک حضور آماده‌به‌کار رأس ساعت ۱۰ در آماده‌سازی"
        ],
        "outputs": [],
        "mechanisms": [
          "پرسنل آماده‌سازی",
          "سرپرست آماده‌سازی"
        ]
      },
      "subprocess": null,
      "position": {
        "x": 40,
        "y": 177.5
      },
      "layout": "auto",
      "source": {
        "created_by": "runs/preparation/20260904-210205",
        "touched_by": []
      }
    },
    {
      "id": "preparation-001-j1",
      "type": "junction",
      "junctionType": "XOR",
      "direction": "split",
      "position": {
        "x": 363,
        "y": 193.5
      },
      "layout": "auto"
    },
    {
      "id": "preparation-001-n002",
      "type": "activity",
      "label": "اعلام تأخیر به سرپرست آماده‌سازی از چند ساعت قبل",
      "description": "اگر برای کسی مشکلی پیش بیاید یا جایی کار داشته باشد، باید از چند ساعت قبل اعلام کند که سر ساعت ۱۰ آماده‌به‌کار نمی‌شود؛ مثلاً حدود ۱۰ دقیقه تأخیر خواهد داشت.",
      "actor": "پرسنل آماده‌سازی",
      "icom": {
        "inputs": [],
        "controls": [
          "الزام اعلام تأخیر از چند ساعت قبل"
        ],
        "outputs": [
          "اعلام تأخیر به سرپرست"
        ],
        "mechanisms": [
          "پرسنل آماده‌سازی"
        ]
      },
      "subprocess": null,
      "position": {
        "x": 560,
        "y": 265.0
      },
      "layout": "auto",
      "source": {
        "created_by": "runs/preparation/20260904-210205",
        "touched_by": []
      }
    },
    {
      "id": "preparation-001-n003",
      "type": "activity",
      "label": "ثبت تأخیر اعلام‌شده در دفتر گزارش روزانه توسط سرپرست",
      "description": "سرپرست آماده‌سازی تأخیرهای اعلام‌شده را در دفتر مخصوص خودش یادداشت می‌کند و در گزارش‌های روزانه می‌آورد.",
      "actor": "سرپرست آماده‌سازی",
      "icom": {
        "inputs": [
          "اعلام تأخیر پرسنل"
        ],
        "controls": [],
        "outputs": [
          "ثبت تأخیر در دفتر گزارش روزانه"
        ],
        "mechanisms": [
          "سرپرست آماده‌سازی",
          "دفتر گزارش روزانه سرپرست"
        ]
      },
      "subprocess": null,
      "position": {
        "x": 820,
        "y": 265.0
      },
      "layout": "auto",
      "source": {
        "created_by": "runs/preparation/20260904-210205",
        "touched_by": []
      }
    },
    {
      "id": "preparation-001-j2",
      "type": "junction",
      "junctionType": "XOR",
      "direction": "join",
      "position": {
        "x": 1143,
        "y": 193.5
      },
      "layout": "auto"
    },
    {
      "id": "preparation-001-n004",
      "type": "activity",
      "label": "تعویض لباس و پوشیدن فرم رستوران در رختکن",
      "description": "سرپرست آماده‌سازی هم لباسش را عوض می‌کند و روپوش می‌پوشد.",
      "actor": "پرسنل آماده‌سازی",
      "icom": {
        "inputs": [],
        "controls": [
          "الزام پوشیدن فرم رستوران"
        ],
        "outputs": [],
        "mechanisms": [
          "رختکن",
          "فرم (لباس کار) رستوران",
          "پرسنل آماده‌سازی"
        ]
      },
      "subprocess": null,
      "position": {
        "x": 1080,
        "y": 440.0
      },
      "layout": "auto",
      "source": {
        "created_by": "runs/preparation/20260904-210205",
        "touched_by": []
      }
    },
    {
      "id": "preparation-001-n005",
      "type": "activity",
      "label": "زدن انگشت ورود پیش از ساعت ۱۰ صبح",
      "description": "ترتیب درست این است که ابتدا لباس عوض شود و بعد انگشت ورود زده شود و سپس فرد وارد محیط آماده‌سازی شود.",
      "actor": "پرسنل آماده‌سازی",
      "icom": {
        "inputs": [],
        "controls": [
          "زدن انگشت ورود پیش از ساعت ۱۰ صبح"
        ],
        "outputs": [
          "ثبت ورود پرسنل با اثر انگشت"
        ],
        "mechanisms": [
          "دستگاه ثبت حضور با اثر انگشت",
          "پرسنل آماده‌سازی"
        ]
      },
      "subprocess": null,
      "position": {
        "x": 820,
        "y": 440.0
      },
      "layout": "auto",
      "source": {
        "created_by": "runs/preparation/20260904-210205",
        "touched_by": []
      }
    },
    {
      "id": "preparation-001-n006",
      "type": "activity",
      "label": "نظارت سرپرست آماده‌سازی بر نظم ورود پرسنل از رأس ساعت ۱۰ صبح",
      "description": "سرپرست رأس ساعت ۱۰ در محیط آماده‌سازی حاضر است و حضور او باعث می‌شود ورود پرسنل منظم باشد.",
      "actor": "سرپرست آماده‌سازی",
      "icom": {
        "inputs": [],
        "controls": [
          "ملاک حضور آماده‌به‌کار رأس ساعت ۱۰ در آماده‌سازی"
        ],
        "outputs": [
          "نظم ورود پرسنل"
        ],
        "mechanisms": [
          "سرپرست آماده‌سازی"
        ]
      },
      "subprocess": null,
      "position": {
        "x": 560,
        "y": 440.0
      },
      "layout": "auto",
      "source": {
        "created_by": "runs/preparation/20260904-210205",
        "touched_by": []
      }
    },
    {
      "id": "preparation-001-n007",
      "type": "activity",
      "label": "حضور آماده‌به‌کار پرسنل در محیط آماده‌سازی رأس ساعت ۱۰ صبح",
      "description": "ملاک مجموعه، حضور آماده‌به‌کار در محل کار در ساعت ۱۰ است، نه صرفِ ساعت ورود به مجموعه؛ از این ساعت کار لاین‌ها در آماده‌سازی شروع می‌شود.",
      "actor": "پرسنل آماده‌سازی",
      "icom": {
        "inputs": [],
        "controls": [
          "ملاک حضور آماده‌به‌کار رأس ساعت ۱۰ در آماده‌سازی"
        ],
        "outputs": [
          "حضور آماده‌به‌کار پرسنل آماده‌سازی در محل کار رأس ساعت ۱۰"
        ],
        "mechanisms": [
          "پرسنل آماده‌سازی"
        ]
      },
      "subprocess": null,
      "position": {
        "x": 300,
        "y": 440.0
      },
      "layout": "auto",
      "source": {
        "created_by": "runs/preparation/20260904-210205",
        "touched_by": []
      }
    }
  ],
  "edges": [
    {
      "from": "preparation-001-n001",
      "to": "preparation-001-j1"
    },
    {
      "from": "preparation-001-j1",
      "to": "preparation-001-j2",
      "label": "در صورت امکان حضور آماده‌به‌کار رأس ساعت ۱۰"
    },
    {
      "from": "preparation-001-j1",
      "to": "preparation-001-n002",
      "label": "در صورت بروز مشکل شخصی یا کار بیرون از مجموعه"
    },
    {
      "from": "preparation-001-n002",
      "to": "preparation-001-n003"
    },
    {
      "from": "preparation-001-n003",
      "to": "preparation-001-j2"
    },
    {
      "from": "preparation-001-j2",
      "to": "preparation-001-n004"
    },
    {
      "from": "preparation-001-n004",
      "to": "preparation-001-n005"
    },
    {
      "from": "preparation-001-n005",
      "to": "preparation-001-n006"
    },
    {
      "from": "preparation-001-n006",
      "to": "preparation-001-n007"
    }
  ],
  "pending": []
}
