{
  "id": "preparation-027",
  "department": "preparation",
  "name": "نظافت آماده‌سازی (روزانه و نظافت اساسی هفتگی)",
  "summary": "در واحد آماده‌سازی نظافت از دیدگاه آشپزی زمان مشخصی ندارد و محیط باید همیشه تمیز باشد، اما برای اینکه فشار مضاعفی به پرسنل وارد نشود حداقل سه نوبت در روز در نظر گرفته شده است: صبح که پرسنل می‌آیند محیط تمیز است، یک نوبت وسط کار و یک نوبت غروب در پایان کار. نظافت هر لاین بر عهده مسئول همان لاین است و همه پرسنل با هم مسئول نظافت محیط آماده‌سازی هستند. در پایان شیفت پس از اینکه کارها صفر و تمام شد، نظافت کلی شامل شستشو و تمیز کردن یخچال‌ها، میز کار، کف و جوی و همه‌جا انجام می‌شود؛ بازه ساعت ۶ تا ۶:۳۰ عصر تایم نظافت پرسنل است و نهایتاً ساعت شش و نیم خروج کار انجام می‌شود، در حالی که سرپرست در همان بازه در جلسه روزانه با مدیر مجموعه حضور دارد. علاوه بر نظافت روزانه، هر هفته یک نظافت اساسی وجود دارد که شامل تمیز کردن داخل یخچال‌ها، لولای یخچال‌ها، پشت یخچال‌ها و بالای قفسه‌های آرد و نقاطی است که لازم است هر هفته تمیز شوند؛ طبق جلسه ۱۴۰۵/۰۶/۱۰ این نظافت اساسی جمعه‌ها انجام می‌شود، چون انجام همه این کارها در یک روز برای پرسنل امکان‌پذیر نیست.",
  "source": {
    "type": "voice",
    "ref": "20260904-210205",
    "run": "runs/preparation/20260904-210205"
  },
  "parent": null,
  "created_at": "2026-09-04T23:44:50Z",
  "updated_at": "2026-09-04T23:44:50Z",
  "idef0": {
    "inputs": [],
    "controls": [
      "الزام همیشه تمیز بودن محیط آماده‌سازی از دیدگاه آشپزی (نظافت تایم مشخصی ندارد)",
      "مسئولیت نظافت هر لاین با مسئول همان لاین و مسئولیت مشترک همه پرسنل نسبت به نظافت کل آماده‌سازی",
      "بازه ساعت ۶ تا ۶:۳۰ عصر به‌عنوان تایم نظافت پرسنل آماده‌سازی",
      "برنامه هفتگی نظافت اساسی در روزهای جمعه",
      "فرم نظافت"
    ],
    "outputs": [
      "یخچال‌ها، میز کار، کف و جوی شسته و تمیز در پایان شیفت",
      "داخل، لولا و پشت یخچال‌ها و بالای قفسه‌های آرد تمیزشده در نظافت اساسی هفتگی"
    ],
    "mechanisms": [
      "پرسنل آماده‌سازی",
      "مسئول هر لاین"
    ]
  },
  "kpis": [],
  "nodes": [
    {
      "id": "preparation-027-n001",
      "type": "activity",
      "label": "نظافت میان‌کار لاین‌ها و محیط آماده‌سازی در وسط شیفت",
      "description": "نظافت از دیدگاه یک آشپز هیچ تایم مشخصی ندارد و محیط همیشه باید تمیز باشد، ولی برای اینکه فشار مضاعفی به پرسنل وارد نشود حداقل سه نوبت در روز در نظر گرفته شده است: صبح که پرسنل می‌آیند محیط تمیز است، یک بار وسط کار و یک بار غروب. نظافت هر لاین مربوط به مسئول همان لاین است و همه پرسنل با هم مسئول نظافت محیط آماده‌سازی هستند.",
      "actor": "پرسنل آماده‌سازی",
      "icom": {
        "inputs": [],
        "controls": [
          "الزام همیشه تمیز بودن محیط",
          "مسئولیت نظافت لاین با مسئول همان لاین"
        ],
        "outputs": [
          "لاین‌ها و محیط تمیز در میانه شیفت"
        ],
        "mechanisms": [
          "پرسنل آماده‌سازی",
          "مسئول هر لاین"
        ]
      },
      "subprocess": null,
      "position": {
        "x": 40,
        "y": 177.5
      },
      "layout": "auto",
      "source": {
        "created_by": "runs/preparation/20260904-210205",
        "touched_by": []
      }
    },
    {
      "id": "preparation-027-j1",
      "type": "junction",
      "junctionType": "XOR",
      "direction": "split",
      "position": {
        "x": 363,
        "y": 193.5
      },
      "layout": "auto"
    },
    {
      "id": "preparation-027-n002",
      "type": "activity",
      "label": "نظافت اساسی هفتگی داخل یخچال‌ها، لولا و پشت یخچال‌ها و بالای قفسه‌های آرد",
      "description": "علاوه بر نظافت روزانه، هر هفته یک نظافت اساسی انجام می‌شود که شامل تمیز کردن داخل یخچال‌ها، لولای یخچال‌ها، پشت یخچال‌ها، بالای قفسه‌های آرد و بعضی جاهایی است که لازم است هر هفته تمیز شوند. دلیل هفتگی بودن این است که اگر بخواهند همه این کارها را در یک روز انجام دهند پرسنل نمی‌رسند. طبق جلسه ۱۴۰۵/۰۶/۱۰ این نظافت اساسی هر هفته جمعه‌ها انجام می‌شود، در حالی که در همان جلسه سرپرست اعلام کرده جمعه‌ها آف است.",
      "actor": "پرسنل آماده‌سازی",
      "icom": {
        "inputs": [],
        "controls": [
          "برنامه هفتگی نظافت اساسی در روزهای جمعه"
        ],
        "outputs": [
          "داخل، لولا و پشت یخچال‌ها و بالای قفسه‌های آرد تمیزشده"
        ],
        "mechanisms": [
          "پرسنل آماده‌سازی"
        ]
      },
      "subprocess": null,
      "position": {
        "x": 560,
        "y": 265.0
      },
      "layout": "auto",
      "source": {
        "created_by": "runs/preparation/20260904-210205",
        "touched_by": []
      }
    },
    {
      "id": "preparation-027-j2",
      "type": "junction",
      "junctionType": "XOR",
      "direction": "join",
      "position": {
        "x": 883,
        "y": 193.5
      },
      "layout": "auto"
    },
    {
      "id": "preparation-027-n003",
      "type": "activity",
      "label": "نظافت و شستشوی کلی پایان شیفت شامل یخچال‌ها، میز کار، کف و جوی در بازه ۶ تا ۶:۳۰ عصر",
      "description": "در پایان کار همه کارها صفر و تمام می‌شود و سپس نظافت انجام می‌گیرد. نظافت کلی شامل شستشو و تمیز کردن یخچال‌ها، میز کار، کف، جوی و همه‌جاست. بازه شش تا شش و نیم عصر تایم نظافت پرسنل آماده‌سازی است و نهایتاً ساعت شش و نیم خروج کار انجام می‌شود؛ در همین بازه سرپرست در جلسه روزانه ۱۸ تا ۱۸:۳۰ با مدیر مجموعه حضور دارد.",
      "actor": "پرسنل آماده‌سازی",
      "icom": {
        "inputs": [],
        "controls": [
          "بازه ساعت ۶ تا ۶:۳۰ عصر به‌عنوان تایم نظافت",
          "اتمام و صفر شدن کارهای تولید پیش از شروع نظافت"
        ],
        "outputs": [
          "یخچال‌ها، میز کار، کف و جوی شسته و تمیز"
        ],
        "mechanisms": [
          "پرسنل آماده‌سازی",
          "مسئول هر لاین"
        ]
      },
      "subprocess": null,
      "position": {
        "x": 1080,
        "y": 177.5
      },
      "layout": "auto",
      "source": {
        "created_by": "runs/preparation/20260904-210205",
        "touched_by": []
      }
    }
  ],
  "edges": [
    {
      "from": "preparation-027-n001",
      "to": "preparation-027-j1"
    },
    {
      "from": "preparation-027-j1",
      "to": "preparation-027-n002",
      "label": "در روزهای جمعه"
    },
    {
      "from": "preparation-027-j1",
      "to": "preparation-027-j2",
      "label": "سایر روزهای هفته"
    },
    {
      "from": "preparation-027-n002",
      "to": "preparation-027-j2"
    },
    {
      "from": "preparation-027-j2",
      "to": "preparation-027-n003"
    }
  ],
  "pending": []
}
