{
  "id": "preparation-029",
  "department": "preparation",
  "name": "جلسه هفتگی آموزشی آماده‌سازی",
  "summary": "واحد آماده‌سازی مانند سایر لاین‌ها جلسه هفتگی آموزشی دارد. چون سرپرست آماده‌سازی روزهای جمعه آف است، این جلسه روزهای پنجشنبه برگزار می‌شود و تلاش می‌شود جمع‌وجور و مفید باشد. مبنای جلسه یک لیست آموزشی است که از طرف مدیریت در اختیار آماده‌سازی قرار گرفته و هر هفته یک بخش از آن اجرا می‌شود؛ برای نمونه موضوع آموزشی یکی از هفته‌ها «سرعت عمل» بوده است. در جلسه برای هر پرسنل توضیح داده می‌شود که در چه کاری سرعت عمل دارد و در چه کاری ندارد تا روی همان مانور بدهد. آموزش‌ها از قبل به پرسنل داده شده و کارها را بلد هستند، بنابراین برای پرسنل باسابقه این جلسه نقش یادآوری دارد و روی پرسنلی که یک تا دو ماه است اضافه شده‌اند بیشتر مانور داده می‌شود. انتظار سرپرست این است که آنچه در جلسه آموزش داده می‌شود توسط پرسنل در کار روزانه اجرا شود.",
  "source": {
    "type": "voice",
    "ref": "20260904-210205",
    "run": "runs/preparation/20260904-210205"
  },
  "parent": null,
  "created_at": "2026-09-04T23:44:51Z",
  "updated_at": "2026-09-11T10:16:39Z",
  "idef0": {
    "inputs": [],
    "controls": [
      "لیست آموزشی ابلاغی مدیریت",
      "برگزاری جلسه در روز پنجشنبه به دلیل آف بودن سرپرست در روز جمعه"
    ],
    "outputs": [
      "آموزش هفتگی ارائه‌شده به پرسنل آماده‌سازی",
      "یادآوری آموزش‌های قبلی به پرسنل"
    ],
    "mechanisms": [
      "سرپرست آماده‌سازی",
      "پرسنل آماده‌سازی"
    ]
  },
  "kpis": [],
  "nodes": [
    {
      "id": "preparation-029-n001",
      "type": "activity",
      "label": "برگزاری جلسه هفتگی آموزشی پرسنل آماده‌سازی در روز پنجشنبه",
      "description": "آماده‌سازی مانند بقیه لاین‌ها جلسه هفتگی دارد. چون سرپرست آماده‌سازی روزهای جمعه آف است، جلسه روزهای پنجشنبه برگزار می‌شود و تلاش می‌شود جلسه خیلی جمع‌وجور و مفید باشد.",
      "actor": "سرپرست آماده‌سازی",
      "icom": {
        "inputs": [],
        "controls": [
          "برگزاری در روز پنجشنبه به دلیل آف بودن سرپرست در روز جمعه"
        ],
        "outputs": [],
        "mechanisms": [
          "سرپرست آماده‌سازی",
          "پرسنل آماده‌سازی"
        ]
      },
      "subprocess": null,
      "position": {
        "x": 40,
        "y": 177.5
      },
      "layout": "auto",
      "source": {
        "created_by": "runs/preparation/20260904-210205",
        "touched_by": []
      }
    },
    {
      "id": "preparation-029-n002",
      "type": "activity",
      "label": "ارائه آموزش موضوع هفته به پرسنل بر اساس لیست آموزشی ابلاغی مدیریت",
      "description": "یک لیست آموزشی از طرف مدیریت در اختیار آماده‌سازی است که هر هفته اجرا می‌شود. برای نمونه در یکی از هفته‌ها موضوع آموزشی «سرعت عمل» بوده است.",
      "actor": "سرپرست آماده‌سازی",
      "icom": {
        "inputs": [],
        "controls": [
          "لیست آموزشی ابلاغی مدیریت"
        ],
        "outputs": [
          "آموزش موضوع هفته ارائه‌شده به پرسنل"
        ],
        "mechanisms": [
          "سرپرست آماده‌سازی"
        ]
      },
      "subprocess": null,
      "position": {
        "x": 300,
        "y": 177.5
      },
      "layout": "auto",
      "source": {
        "created_by": "runs/preparation/20260904-210205",
        "touched_by": []
      }
    },
    {
      "id": "preparation-029-n003",
      "type": "activity",
      "label": "توضیح نقاط قوت و ضعف هر پرسنل در موضوع آموزشی برای مانور دادن روی کار ضعیف‌تر",
      "description": "در موضوع سرعت عمل، خود پرسنل سرعت عمل دارند و فقط برای آن‌ها توضیح داده می‌شود که در چه کاری سرعت عمل دارند و در چه کاری ندارند تا روی همان مانور بدهند.",
      "actor": "سرپرست آماده‌سازی",
      "icom": {
        "inputs": [],
        "controls": [],
        "outputs": [],
        "mechanisms": [
          "سرپرست آماده‌سازی"
        ]
      },
      "subprocess": null,
      "position": {
        "x": 560,
        "y": 177.5
      },
      "layout": "auto",
      "source": {
        "created_by": "runs/preparation/20260904-210205",
        "touched_by": []
      }
    },
    {
      "id": "preparation-029-j1",
      "type": "junction",
      "junctionType": "XOR",
      "direction": "split",
      "position": {
        "x": 883,
        "y": 193.5
      },
      "layout": "auto"
    },
    {
      "id": "preparation-029-n004",
      "type": "activity",
      "label": "مانور بیشتر آموزش روی پرسنل تازه‌وارد با یک تا دو ماه سابقه",
      "description": "روی پرسنلی که مثلاً یک ماه یا دو ماه است اضافه شده‌اند بیشتر مانور داده می‌شود.",
      "actor": "سرپرست آماده‌سازی",
      "icom": {
        "inputs": [],
        "controls": [],
        "outputs": [],
        "mechanisms": [
          "سرپرست آماده‌سازی"
        ]
      },
      "subprocess": null,
      "position": {
        "x": 1080,
        "y": 90
      },
      "layout": "auto",
      "source": {
        "created_by": "runs/preparation/20260904-210205",
        "touched_by": []
      }
    },
    {
      "id": "preparation-029-n005",
      "type": "activity",
      "label": "یادآوری آموزش‌های قبلی به پرسنل باسابقه",
      "description": "آموزش‌ها از قبل داده شده است و پرسنل کارها را بلد هستند؛ با این حال این آموزش‌ها باعث یادآوری برای بچه‌ها می‌شود.",
      "actor": "سرپرست آماده‌سازی",
      "icom": {
        "inputs": [],
        "controls": [],
        "outputs": [
          "یادآوری آموزش‌های قبلی"
        ],
        "mechanisms": [
          "سرپرست آماده‌سازی"
        ]
      },
      "subprocess": null,
      "position": {
        "x": 956.0759493670885,
        "y": 293.5443037974684
      },
      "layout": "manual",
      "source": {
        "created_by": "runs/preparation/20260904-210205",
        "touched_by": [
          "ui-edit"
        ]
      }
    },
    {
      "id": "preparation-029-j2",
      "type": "junction",
      "junctionType": "XOR",
      "direction": "join",
      "position": {
        "x": 1143,
        "y": 456
      },
      "layout": "auto"
    },
    {
      "id": "preparation-029-n006",
      "type": "activity",
      "label": "اجرای آموزش‌های ارائه‌شده در جلسه توسط پرسنل در کار روزانه",
      "description": "توقع سرپرست این است که آنچه در جلسه به پرسنل آموزش داده می‌شود توسط آن‌ها اجرا شود.",
      "actor": "پرسنل آماده‌سازی",
      "icom": {
        "inputs": [],
        "controls": [
          "لیست آموزشی ابلاغی مدیریت"
        ],
        "outputs": [],
        "mechanisms": [
          "پرسنل آماده‌سازی"
        ]
      },
      "subprocess": null,
      "position": {
        "x": 803.2911392405064,
        "y": 421.20253164556965
      },
      "layout": "manual",
      "source": {
        "created_by": "runs/preparation/20260904-210205",
        "touched_by": [
          "ui-edit"
        ]
      }
    }
  ],
  "edges": [
    {
      "from": "preparation-029-n001",
      "to": "preparation-029-n002"
    },
    {
      "from": "preparation-029-n002",
      "to": "preparation-029-n003"
    },
    {
      "from": "preparation-029-n003",
      "to": "preparation-029-j1"
    },
    {
      "from": "preparation-029-j1",
      "to": "preparation-029-n004",
      "label": "پرسنل تازه‌وارد با یک تا دو ماه سابقه"
    },
    {
      "from": "preparation-029-j1",
      "to": "preparation-029-n005",
      "label": "پرسنل باسابقه و آموزش‌دیده"
    },
    {
      "from": "preparation-029-n004",
      "to": "preparation-029-j2"
    },
    {
      "from": "preparation-029-n005",
      "to": "preparation-029-j2"
    },
    {
      "from": "preparation-029-j2",
      "to": "preparation-029-n006"
    }
  ],
  "pending": []
}
