{
  "id": "preparation-011",
  "department": "preparation",
  "name": "پخت و بسته‌بندی پاستا (پنه)",
  "summary": "پخت پاستا (پنه) از کارهایی است که لاین ثابتی در آماده‌سازی ندارد و بر اساس نظریه (سفارش) روزانه انبار انجام می‌شود؛ اگر در نظریه آن روز درخواست پاستا ثبت نشده باشد، پاستا پخته نمی‌شود و کار به کسی سپرده نمی‌شود. در روزهایی که درخواست وجود دارد، سرپرست آماده‌سازی بر اساس اینکه کدام لاین سبک‌تر است مجری کار را تعیین می‌کند. کارگر لاین مرغ (تخته‌کار) در ابتدای شیفت و پس از تمیز کردن تخته کار، آب پاستا را می‌گذارد تا جوش بیاید (آب پیش از تیک زدن چک‌لیست انبار به جوش می‌آید) و پنه خام را به تعداد بسته‌های درخواست‌شده — مثلاً پنج تا شش بسته — می‌پزد؛ هر بسته پنه خام ۵۰۰ گرمی حدود یک کیلو و دویست تا یک کیلو و ۲۵۰ گرم پنه پخته می‌دهد. پس از پایان ریزه‌کاری‌های صبح و از حدود ساعت ۱۲، پنه در بسته‌های یک کیلو و دویست گرمی بسته‌بندی، وزن‌گیری و سپس اسم‌گذاری (لیبل‌گذاری) می‌شود.",
  "source": {
    "type": "voice",
    "ref": "20260904-210205",
    "run": "runs/preparation/20260904-210205"
  },
  "parent": {
    "process": "preparation-032",
    "node": "preparation-032-n009"
  },
  "created_at": "2026-09-04T23:44:44Z",
  "updated_at": "2026-09-10T14:05:23Z",
  "idef0": {
    "inputs": [
      "پنه خام در بسته‌های ۵۰۰ گرمی",
      "آب",
      "فرم نظریه (سفارش) روزانه انبار"
    ],
    "controls": [
      "مقدار درخواستی انبار به تفکیک شعبه مرکزی و شعبه",
      "وزن هر بسته پنه پخته: یک کیلو و دویست گرم",
      "نسبت تولید: هر بسته پنه خام ۵۰۰ گرمی، یک کیلو و دویست تا یک کیلو و ۲۵۰ گرم پنه پخته می‌دهد",
      "تعیین مجری کار توسط سرپرست آماده‌سازی (پخت پاستا لاین ثابتی ندارد)"
    ],
    "outputs": [
      "بسته‌های پنه پخته وزن‌گیری‌شده و لیبل‌خورده"
    ],
    "mechanisms": [
      "سرپرست آماده‌سازی",
      "کارگر لاین مرغ (تخته‌کار)"
    ]
  },
  "kpis": [],
  "nodes": [
    {
      "id": "preparation-011-n001",
      "type": "activity",
      "label": "بررسی سفارش روزانه انبار و مشخص شدن مقدار درخواستی پنه",
      "description": "انبار هر روز مقدار موردنیاز هر قلم را به تفکیک شعبه مرکزی و شعبه در فرم نظریه برای آماده‌سازی می‌نویسد و آماده‌سازی طبق همین نظریه جلو می‌رود. تولید پاستا چیز ثابتی نیست و مقدار آن هر روز بر اساس نیاز تعیین می‌شود؛ مثلاً «به وزنی که خواستن، پنج بسته یا شش بسته».",
      "actor": "سرپرست آماده‌سازی",
      "icom": {
        "inputs": [
          "فرم نظریه (سفارش) روزانه انبار"
        ],
        "controls": [
          "تفکیک مقدار درخواستی بین شعبه مرکزی و شعبه"
        ],
        "outputs": [
          "مقدار مشخص‌شده پنه موردنیاز آن روز"
        ],
        "mechanisms": [
          "انبار",
          "سرپرست آماده‌سازی"
        ]
      },
      "subprocess": null,
      "position": {
        "x": 46.80952978056425,
        "y": 191.11905956112855
      },
      "layout": "manual",
      "source": {
        "created_by": "runs/preparation/20260904-210205",
        "touched_by": [
          "ui-edit"
        ]
      }
    },
    {
      "id": "preparation-011-n003",
      "type": "activity",
      "label": "تعیین مجری پخت پاستا توسط سرپرست آماده‌سازی و بر اساس میزان مسئولیت روزانه پرسنل هر لاین",
      "description": "پخت پاستا جزو کارهایی است که لاین مشخصی ندارد و بین بقیه همکاران تقسیم شده است؛ تقریباً همه این کار را بلدند و سرپرست بر اساس اینکه امروز کدام لاین سبک‌تر است یا کار اضافه‌تری دارد، تعیین می‌کند چه کسی آن را انجام دهد. اگر چیزی هم گفته نشود، خود افراد طبق لیست می‌دانند هر کس کدام قسمت کار را برمی‌دارد.",
      "actor": "سرپرست آماده‌سازی",
      "icom": {
        "inputs": [],
        "controls": [
          "نظر سرپرست بر اساس حجم کار لاین‌ها",
          "لیست کارهای روزانه"
        ],
        "outputs": [
          "مجری تعیین‌شده برای پخت پاستا"
        ],
        "mechanisms": [
          "سرپرست آماده‌سازی"
        ]
      },
      "subprocess": null,
      "position": {
        "x": 352.30934169279,
        "y": 195.2023197492163
      },
      "layout": "manual",
      "source": {
        "created_by": "runs/preparation/20260904-210205",
        "touched_by": [
          "ui-edit"
        ]
      }
    },
    {
      "id": "preparation-011-n004",
      "type": "activity",
      "label": "گذاشتن آب پاستا روی حرارت در ابتدای شیفت تا جوش آمدن",
      "description": "در ابتدای شیفت و بلافاصله پس از تمیز کردن تخته کار انجام می‌شود؛ آب پاستا تا پیش از تیک زدن چک‌لیست اقلام تحویلی انبار به جوش می‌آید.",
      "actor": "کارگر لاین مرغ (تخته‌کار)",
      "icom": {
        "inputs": [
          "آب"
        ],
        "controls": [],
        "outputs": [
          "آب جوش آماده پخت پاستا"
        ],
        "mechanisms": [
          "کارگر لاین مرغ (تخته‌کار)"
        ]
      },
      "subprocess": null,
      "position": {
        "x": 645.5057993730406,
        "y": 198.60708463949842
      },
      "layout": "manual",
      "source": {
        "created_by": "runs/preparation/20260904-210205",
        "touched_by": [
          "ui-edit"
        ]
      }
    },
    {
      "id": "preparation-011-n005",
      "type": "activity",
      "label": "پخت پنه خام در آب جوش به تعداد بسته‌های درخواست‌شده (مثلاً پنج تا شش بسته)",
      "description": "پنه خام را انبار تحویل می‌دهد و پخت بر اساس نیاز و تعداد بسته درخواستی انجام می‌شود. اصولاً یک بسته پنه ۵۰۰ گرمی، یک کیلو و دویست تا یک کیلو و ۲۵۰ گرم پنه پخته تولید می‌کند. گاهی پاستای شکسته وجود دارد — مثلاً از پنج بسته‌ای که پخته می‌شود دو بسته‌اش شکسته درمی‌آید — ولی مبنای تولید بر شکستگی گذاشته نمی‌شود.",
      "actor": "کارگر لاین مرغ (تخته‌کار)",
      "icom": {
        "inputs": [
          "پنه خام در بسته‌های ۵۰۰ گرمی",
          "آب جوش"
        ],
        "controls": [
          "تعداد بسته درخواستی انبار",
          "نسبت تولید هر بسته ۵۰۰ گرمی به یک کیلو و دویست تا یک کیلو و ۲۵۰ گرم پنه پخته"
        ],
        "outputs": [
          "پنه پخته"
        ],
        "mechanisms": [
          "کارگر لاین مرغ (تخته‌کار)"
        ]
      },
      "subprocess": null,
      "position": {
        "x": 948.9165517241379,
        "y": 192.64874608150473
      },
      "layout": "manual",
      "source": {
        "created_by": "runs/preparation/20260904-210205",
        "touched_by": [
          "ui-edit"
        ]
      }
    },
    {
      "id": "preparation-011-n006",
      "type": "activity",
      "label": "بسته‌بندی پنه پخته در بسته‌های یک کیلو و دویست گرمی",
      "description": "بسته‌بندی پنه پس از انجام شدن ریزه‌کاری‌های صبح و از حدود ساعت ۱۲ انجام می‌شود. بسته‌بندی پنه بر اساس وزن است و هر بسته یک کیلو و دویست گرم.",
      "actor": "کارگر لاین مرغ (تخته‌کار)",
      "icom": {
        "inputs": [
          "پنه پخته"
        ],
        "controls": [
          "وزن هر بسته: یک کیلو و دویست گرم",
          "شروع کار بسته‌بندی از حدود ساعت ۱۲"
        ],
        "outputs": [
          "بسته‌های پنه پخته"
        ],
        "mechanisms": [
          "کارگر لاین مرغ (تخته‌کار)"
        ]
      },
      "subprocess": null,
      "position": {
        "x": 1023.8213793103448,
        "y": 430.63689655172413
      },
      "layout": "manual",
      "source": {
        "created_by": "runs/preparation/20260904-210205",
        "touched_by": [
          "ui-edit"
        ]
      }
    },
    {
      "id": "preparation-011-n007",
      "type": "activity",
      "label": "وزن‌گیری بسته‌های پنه",
      "description": "هر بسته پنه وزن‌گیری می‌شود تا با وزن یک کیلو و دویست گرم مطابقت داشته باشد.",
      "actor": "کارگر لاین مرغ (تخته‌کار)",
      "icom": {
        "inputs": [
          "بسته‌های پنه پخته"
        ],
        "controls": [
          "وزن هر بسته: یک کیلو و دویست گرم"
        ],
        "outputs": [
          "وزن ثبت‌شده هر بسته"
        ],
        "mechanisms": [
          "کارگر لاین مرغ (تخته‌کار)"
        ]
      },
      "subprocess": null,
      "position": {
        "x": 729.7737304075234,
        "y": 445.10714733542324
      },
      "layout": "manual",
      "source": {
        "created_by": "runs/preparation/20260904-210205",
        "touched_by": [
          "ui-edit"
        ]
      }
    },
    {
      "id": "preparation-011-n008",
      "type": "activity",
      "label": "اسم‌گذاری و لیبل‌گذاری بسته‌های پنه",
      "description": "روی بسته‌های پنه اسم‌گذاری (لیبل‌گذاری) انجام می‌شود؛ خروجی کار بسته‌های پنه پخته وزن‌گیری‌شده و لیبل‌خورده است.",
      "actor": "کارگر لاین مرغ (تخته‌کار)",
      "icom": {
        "inputs": [
          "بسته‌های پنه وزن‌گیری‌شده"
        ],
        "controls": [],
        "outputs": [
          "بسته‌های پنه پخته لیبل‌خورده"
        ],
        "mechanisms": [
          "کارگر لاین مرغ (تخته‌کار)"
        ]
      },
      "subprocess": null,
      "position": {
        "x": 460.4106269592476,
        "y": 437.4464263322884
      },
      "layout": "manual",
      "source": {
        "created_by": "runs/preparation/20260904-210205",
        "touched_by": [
          "ui-edit"
        ]
      }
    }
  ],
  "edges": [
    {
      "from": "preparation-011-n003",
      "to": "preparation-011-n004"
    },
    {
      "from": "preparation-011-n004",
      "to": "preparation-011-n005"
    },
    {
      "from": "preparation-011-n005",
      "to": "preparation-011-n006"
    },
    {
      "from": "preparation-011-n006",
      "to": "preparation-011-n007"
    },
    {
      "from": "preparation-011-n007",
      "to": "preparation-011-n008"
    },
    {
      "from": "preparation-011-n001",
      "to": "preparation-011-n003",
      "label": ""
    }
  ],
  "pending": []
}
